{
  "$schema": "http://json-schema.org/draft-07/schema#",
  "$id": "https://plugins.eliza.app/schema/registry-entry.schema.json",
  "title": "elizaOS third-party registry entry",
  "description": "One JSON file per community package under entries/third-party/. Mirrors src/schema.ts.",
  "type": "object",
  "additionalProperties": false,
  "required": ["package", "repository", "kind"],
  "allOf": [
    {
      "if": {
        "properties": { "kind": { "const": "app" } },
        "required": ["kind"]
      },
      "then": { "required": ["app"] },
      "else": { "not": { "required": ["app"] } }
    }
  ],
  "properties": {
    "package": {
      "type": "string",
      "description": "npm package name. The @elizaos/* scope is reserved for first-party.",
      "maxLength": 214,
      "pattern": "^(?:@[a-z0-9][a-z0-9._-]*\\/)?[a-z0-9][a-z0-9._-]*$",
      "not": { "pattern": "^@elizaos\\/" }
    },
    "repository": {
      "type": "string",
      "description": "GitHub repository as github:owner/repo.",
      "pattern": "^github:[A-Za-z0-9_.-]+\\/[A-Za-z0-9_.-]+$"
    },
    "kind": {
      "type": "string",
      "description": "What the package is.",
      "enum": ["plugin", "connector", "app"]
    },
    "description": {
      "type": "string",
      "description": "One-line description."
    },
    "homepage": {
      "type": "string",
      "description": "Project homepage URL."
    },
    "version": {
      "type": "string",
      "description": "Published npm version this entry was registered against."
    },
    "directory": {
      "type": "string",
      "description": "Monorepo subdirectory when the package lives inside a larger repo."
    },
    "tags": {
      "type": "array",
      "description": "Discovery tags (npm keywords minus elizaos boilerplate).",
      "items": { "type": "string" }
    },
    "app": {
      "type": "object",
      "description": "Launch metadata consumed before an app package is installed.",
      "additionalProperties": false,
      "required": [
        "displayName",
        "category",
        "launchType",
        "launchUrl",
        "icon",
        "capabilities"
      ],
      "properties": {
        "displayName": { "type": "string", "minLength": 1 },
        "category": { "type": "string", "minLength": 1 },
        "launchType": { "type": "string", "minLength": 1 },
        "launchUrl": { "type": ["string", "null"] },
        "icon": { "type": ["string", "null"] },
        "heroImage": { "type": ["string", "null"] },
        "capabilities": {
          "type": "array",
          "items": { "type": "string" }
        },
        "minPlayers": {
          "type": ["integer", "null"],
          "minimum": 0
        },
        "maxPlayers": {
          "type": ["integer", "null"],
          "minimum": 0
        },
        "runtimePlugin": { "type": "string" },
        "bridgeExport": { "type": "string" },
        "uiExtension": {
          "type": "object",
          "additionalProperties": false,
          "required": ["detailPanelId"],
          "properties": {
            "detailPanelId": { "type": "string", "minLength": 1 }
          }
        },
        "viewer": {
          "type": "object",
          "additionalProperties": false,
          "required": ["url"],
          "properties": {
            "url": { "type": "string", "minLength": 1 },
            "embedParams": {
              "type": "object",
              "additionalProperties": { "type": "string" }
            },
            "postMessageAuth": { "type": "boolean" },
            "sandbox": { "type": "string" }
          }
        },
        "session": {
          "type": "object",
          "additionalProperties": false,
          "required": ["mode"],
          "properties": {
            "mode": {
              "type": "string",
              "enum": ["viewer", "spectate-and-steer", "external"]
            },
            "features": {
              "type": "array",
              "items": {
                "type": "string",
                "enum": [
                  "commands",
                  "telemetry",
                  "pause",
                  "resume",
                  "suggestions"
                ]
              }
            }
          }
        },
        "developerOnly": { "type": "boolean" },
        "visibleInAppStore": { "type": "boolean" },
        "mainTab": { "type": "boolean" },
        "catalogSection": { "type": "string" },
        "featured": { "type": "boolean" },
        "defaultHidden": { "type": "boolean" },
        "scope": { "type": "string" }
      }
    }
  }
}
